objectid,title,date,date-is-approximate?,creator,recipient,description,item_information,subject,location,latitude,longitude,related_publication,publisher-digital,source,findingaid,original-identifier,rights,rightsstatement,type,format,language,relation,filename,identifier,display_template,object_location,image_small,image_thumb,image_alt_text,object_transcript,proceso,soporte,iluminacion,tono,tipologia,polaridad
impresion_054,Retrato eduardiano,1905,,Charles L. Gresham (Estudio Gresham),,"Retrato de estudio de una joven mujer en plano medio corto, presentado en un óvalo. Viste una blusa clara de cuello alto con encajes, un broche central y un ramillete floral. Su cabello está recogido con un lazo oscuro de gran tamaño, característico de la estética de principios del siglo XX.",,Retrato eduardiano; Estudio fotográfico; Moda femenina 1900,"Bloomfield, Iowa, Estados Unidos",40.7511,-92.4144,,,,,,,,Image;StillImage,image/jpeg,es,,impresion_054.jpg,2039t,image,/objects/impresion_054.jpg,/objects/small/impresion_054_sm.jpg,/objects/thumbs/impresion_054_th.jpg,,,Colodión húmedo,Vidrio,Transmisión,Policromático,Impresión,Positivo
impresion_055,Tarjeta postal,1914,,Charles L'Hôpital & Cie (Editor),,"Retrato de estudio de una persona joven con indumentaria formal masculina de inicios del siglo XX, compuesta por un traje de saco y pantalón en lana texturizada, cuello rígido y sombrero de ala circular. La imagen está intervenida con inscripciones manuscritas en portugués que expresan sentimientos de ausencia y nostalgia, fechadas en abril de 1914.",,Tarjeta postal; Retrato infantil; Belle Époque,"Lisboa, Portugal",38.7223,-9.1393,,,,,,,,Image;StillImage,image/jpeg,es,,impresion_055.jpg,ed4ffk,image,/objects/impresion_055.jpg,/objects/small/impresion_055_sm.jpg,/objects/thumbs/impresion_055_th.jpg,,,Tarjeta postal de tipo 'Real Photo Postcard' (RPPC),Papel,Transmisión,Monocromático,Impresión,Negativo
impresion_056,Retrato Victoriano,1885,,Charles S. Rabineau,,"Retrato de estudio en plano medio corto de una mujer joven. La figura posa de tres cuartos con la mirada dirigida hacia un lateral. Viste una prenda oscura de cuello alto, decorada con un collar metálico y un broche. Su cabello está recogido en un moño elaborado con flequillo de rizos cortos sobre la frente, siguiendo la moda victoriana tardía de la década de 1880.",,Retrato Victoriano; Cabinet Card; Charles S. Rabineau,"Albany, Nueva York, Estados Unidos",42.6526,-73.7562,,,,,,,,Image;StillImage,image/jpeg,es,,impresion_056.jpg,5fl8xz,image,/objects/impresion_056.jpg,/objects/small/impresion_056_sm.jpg,/objects/thumbs/impresion_056_th.jpg,,,Albúmina,Vidrio,Transmisión,Monocromático,Negativo,Negativo
impresion_057,Retrato de estudio,1945,,Anónimo,,Retrato de estudio de una mujer joven capturada en un plano medio corto. La figura mira ligeramente hacia un lado con una expresión serena. Viste una prenda oscura con un detalle decorativo bordado o de encaje alrededor del cuello. El peinado presenta ondas estructuradas típicas de la moda de mediados del siglo XX.,,Retrato de estudio; Moda años 40; Papel seda,"Madrid, España",40.4168,-3.7038,,,,,,,,Image;StillImage,image/jpeg,es,,impresion_057.jpg,wdm4ze,image,/objects/impresion_057.jpg,/objects/small/impresion_057_sm.jpg,/objects/thumbs/impresion_057_th.jpg,,,Impresión plata gelatina de revelado,Película,Transmisión,Monocromático,Impresión,Positivo
impresion_058,Pesca recreativa,1950,,Anónimo,,"La imagen muestra una captura de aproximadamente ocho peces dispuestos en hilera sobre una superficie clara, probablemente un muelle de concreto o arena compacta. Al fondo se observa parte de una embarcación de madera y tablones de un muelle. Es una fotografía documental de carácter privado que registra una jornada de pesca exitosa a mediados del siglo XX.",,Pesca recreativa; Lubina; Cultura lacustre,"Región de los Grandes Lagos, Michigan, EE. UU.",44.3148,-85.6024,,,,,,,,Image;StillImage,image/jpeg,es,,impresion_058.jpg,1ypx19,image,/objects/impresion_058.jpg,/objects/small/impresion_058_sm.jpg,/objects/thumbs/impresion_058_th.jpg,,,Impresión plata gelatina de revelado,Película,Transmisión,Monocromático,Impresión,Positivo
impresion_059,Carte de visite,1870,,Anónimo,,"Retrato de estudio de un hombre de mediana edad con bigote y cabello ondulado, posando sentado. Viste un traje formal de tres piezas con un saco tipo 'sack coat' y chaleco. Se encuentra en un entorno controlado con una silla de madera tallada y una mesa con mantel decorado, elementos típicos de la escenografía fotográfica decimonónica.",,Carte de visite; Moda victoriana; Albúmina,Estados Unidos de América,39.8283,-98.5795,,,,,,,,Image;StillImage,image/jpeg,es,,impresion_059.jpg,ccaopt,image,/objects/impresion_059.jpg,/objects/small/impresion_059_sm.jpg,/objects/thumbs/impresion_059_th.jpg,,,Albúmina,Papel,Reflexión,Monocromático,Impresión,Positivo
impresion_060,Retrato victoriano,1880,,Anónimo,,"Retrato de estudio de un niño con gesto serio, capturado en un encuadre de viñeta ovalada. El menor viste un saco formal de textura gruesa, probablemente lana, con tres botones visibles, acompañado de una camisa de cuello rígido y un pequeño lazo o moño oscuro, reflejando las convenciones sociales del retrato infantil decimonónico.",,Retrato victoriano; Impresión a la albúmina; Fotografía de estudio,Noreste de Estados Unidos (estimado por el estilo del estudio),40.7128,-74.006,,,,,,,,Image;StillImage,image/jpeg,es,,impresion_060.jpg,2v18sr,image,/objects/impresion_060.jpg,/objects/small/impresion_060_sm.jpg,/objects/thumbs/impresion_060_th.jpg,,,Albúmina,Papel,Reflexión,Policromático,Impresión,Positivo
impresion_061,Retrato victoriano,1890,,Egide Verhassel,,"Retrato de estudio de un niño de pie, vestido con un traje formal oscuro de tres piezas: chaqueta, chaleco y pantalones tipo bombacho. El sujeto sostiene un sombrero en su mano derecha y un pequeño objeto rectangular, posiblemente un libro, en la izquierda. El entorno incluye una silla decorativa, una mesa con mantel floral y plantas ornamentales de gran tamaño al fondo.",,Retrato victoriano; Carte de visite; Moda infantil del siglo XIX,"Bruselas, Bélgica",50.854,4.3395,,,,,,,,Image;StillImage,image/jpeg,es,,impresion_061.jpg,e7srnm,image,/objects/impresion_061.jpg,/objects/small/impresion_061_sm.jpg,/objects/thumbs/impresion_061_th.jpg,,,Albúmina,Vidrio,Transmisión,Sepia,Impresión,Positivo
impresion_062,Ingeniería,1883,,Anónimo (Estudio fotográfico profesional),,"Retrato de estudio de un hombre joven captado de tres cuartos. El sujeto posee cabello corto, un bigote denso y utiliza anteojos circulares. Viste una chaqueta de textura gruesa con solapas pequeñas, una camisa de cuello alto y un corbatín oscuro. La composición y el fondo neutro son típicos de la retratística comercial decimonónica.",,Ingeniería; Rudolf Diesel; Retrato decimonónico,"París, Francia",48.8566,2.3522,,,,,,,,Image;StillImage,image/jpeg,es,,impresion_062.jpg,6qo4c,image,/objects/impresion_062.jpg,/objects/small/impresion_062_sm.jpg,/objects/thumbs/impresion_062_th.jpg,,,Albúmina,Película,Transmisión,Sepia,Impresión,Positivo
impresion_063,Retrato de estudio,1885,,Anónimo,,"Retrato de estudio de una infante de pie, ataviada con un vestido de patrón cuadrangular con volantes y botas altas de piel. Se apoya en una silla tapizada de estilo victoriano con flecos decorativos. La escena, capturada ante un telón pintado, incluye un álbum ornamental en el suelo, reflejando las convenciones estéticas y sociales del retrato burgués de finales del siglo XIX.",,Retrato de estudio; Moda infantil victoriana; Copia a la albúmina,"Londres, Reino Unido (entorno urbano general)",51.5074,-0.1278,,,,,,,,Image;StillImage,image/jpeg,es,,impresion_063.jpg,4fgvlr,image,/objects/impresion_063.jpg,/objects/small/impresion_063_sm.jpg,/objects/thumbs/impresion_063_th.jpg,,,Albúmina,Papel,Reflexión,Sepia,Impresión,Positivo
impresion_064,Retrato,1875,,Anónimo,,"Retrato de estudio de un hombre joven con bigote poblado, captado en plano medio corto y vista de tres cuartos. Viste indumentaria formal masculina de finales del siglo XIX, consistente en un saco oscuro, chaleco a juego, camisa de cuello r!gido y un corbat!n de lazo oscuro. La imagen refleja la sobriedad t!pica del retrato social decimon3nico.",,Retrato; Siglo XIX; Carte de Visite,Estados Unidos o Europa (Probable centro urbano),40.712776,-74.005974,,,,,,,,Image;StillImage,image/jpeg,es,,impresion_064.jpg,3cfwak,image,/objects/impresion_064.jpg,/objects/small/impresion_064_sm.jpg,/objects/thumbs/impresion_064_th.jpg,,,Albúmina,Papel,Reflexión,Monocromático,Impresión,Positivo
impresion_065,Segunda Guerra Mundial,1945,,Anónimo,,"Retrato de cuerpo entero de un soldado de la Policía Militar estadounidense en un entorno rural lodoso. El individuo viste una chaqueta de campo M-1943, casco con las siglas 'MP' y botas de combate. La escena, capturada en exteriores con árboles caducifolios al fondo, evoca el periodo de la Segunda Guerra Mundial o la posguerra inmediata.",,Segunda Guerra Mundial; Policía Militar; Chaqueta M-1943,"Región de las Ardenas, Bélgica/Luxemburgo",50.126,5.707,,,,,,,,Image;StillImage,image/jpeg,es,,impresion_065.jpg,d4wmri,image,/objects/impresion_065.jpg,/objects/small/impresion_065_sm.jpg,/objects/thumbs/impresion_065_th.jpg,,,Impresión plata gelatina de revelado,Película,Transmisión,Monocromático,Impresión,Positivo
impresion_066,Carte de Visite,1860,,Anónimo,,"Retrato de estudio de un hombre adulto con cabello ondulado y barba abundante sin bigote. Viste una indumentaria formal compuesta por una levita oscura, chaleco abotonado, camisa blanca de cuello alto y corbatín oscuro. El sujeto aparece sentado en una pose formal, con el brazo izquierdo apoyado sobre una mesa cubierta con un mantel de motivos decorativos florales.",,Carte de Visite; Moda victoriana; Retrato de estudio,Estados Unidos,38.9072,-77.0369,,,,,,,,Image;StillImage,image/jpeg,es,,impresion_066.jpg,wetb5c,image,/objects/impresion_066.jpg,/objects/small/impresion_066_sm.jpg,/objects/thumbs/impresion_066_th.jpg,,,Albúmina,Vidrio,Transmisión,Monocromático,Negativo,Negativo
impresion_067,William S. Burroughs,1980,,Anónimo (Círculo personal de Burroughs),,Retrato masculino de plano medio corto donde aparece un hombre de edad avanzada con expresion serena. El sujeto viste una chaqueta acolchada de color oscuro sobre una camisa de franela a cuadros y un chaleco. La fotografia presenta una iluminacion directa y frontal con un fondo claro donde se aprecia ligeramente la caida de una cortina en el lado derecho.,,William S. Burroughs; Generación Beat; Literatura Postmoderna,"Lawrence, Kansas, Estados Unidos",38.9717,-95.2353,,,,,,,,Image;StillImage,image/jpeg,es,,impresion_067.jpg,p5mlps,image,/objects/impresion_067.jpg,/objects/small/impresion_067_sm.jpg,/objects/thumbs/impresion_067_th.jpg,,,Copia positiva en blanco y negro,Papel,Reflexión,Monocromático,Impresión,Positivo
impresion_068,RAF Bomber Command,1943,,Fotógrafo oficial de la RAF o personal de servicio (Anónimo),,"Vista exterior de la entrada a un alojamiento militar, probablemente un cuartel de tripulación aérea durante la Segunda Guerra Mundial. En la puerta de madera destaca un cartel titulado 'The Blockbuster Boys', ilustrado con arte gráfico que incluye el rostro de una mujer, un bombardero y una cerveza. Una bicicleta se encuentra apoyada contra la pared lateral.",,RAF Bomber Command; Segunda Guerra Mundial; Nissen hut,"Condado de Lincolnshire, Inglaterra (Probable base de la RAF como Coningsby o Scampton)",53.111,-0.155,,,,,,,,Image;StillImage,image/jpeg,es,,impresion_068.jpg,gznvd,image,/objects/impresion_068.jpg,/objects/small/impresion_068_sm.jpg,/objects/thumbs/impresion_068_th.jpg,,,Impresión plata gelatina de revelado,Película,Transmisión,Monocromático,Negativo,Negativo
impresion_069,Retrato de estudio,1945,,Anónimo,,"Retrato de estudio de una mujer joven de medio cuerpo. La figura luce una prenda con patr'n de rayas verticales y un cuello oscuro contrastante con botones al frente. Su cabello est' peinado hacia atr's, resaltando aretes peque'os. La toma presenta un suave desvanecido perif'rico, t'pico de la retrat'stica comercial mexicana de los a'os 40 y 50.",,Retrato de estudio; Moda de los años 40; Gelatina de plata,"Madrid, España (Atribuido por estilo de estudio europeo)",40.4168,-3.7038,,,,,,,,Image;StillImage,image/jpeg,es,,impresion_069.jpg,oq6j1,image,/objects/impresion_069.jpg,/objects/small/impresion_069_sm.jpg,/objects/thumbs/impresion_069_th.jpg,,,Impresión plata gelatina de revelado,Película,Transmisión,Monocromático,Negativo,Negativo
impresion_070,Retrato documental,1979,,Richard Avedon,,"Retrato en plano medio de un hombre de edad avanzada capturado en un formato de identificacion. El sujeto muestra una expresion de sorpresa con la boca ligeramente abierta, vistiendo una chaqueta acolchada sobre una camisa de cuadros. El fondo es neutro con el detalle de una cortina a la derecha, indicando un entorno de cabina fotografica o estudio basico.",,Retrato documental; Gran formato; Oeste americano,"Casper, Wyoming, Estados Unidos",42.8501,-106.3251,,,,,,,,Image;StillImage,image/jpeg,es,,impresion_070.jpg,rbbk5,image,/objects/impresion_070.jpg,/objects/small/impresion_070_sm.jpg,/objects/thumbs/impresion_070_th.jpg,,,Impresión plata gelatina de revelado,Película,Transmisión,Monocromático,Negativo,Negativo
impresion_071,Arquitectura industrial,1930,,Anónimo,,"Fotografía de la Torre del Caracol en Real de Asientos, Aguascalientes. Esta estructura industrial de piedra presenta una rampa en espiral y funcionaba como chimenea para la fundición de metales. En la cima se observan dos personas, mientras que el fondo muestra el relieve montañoso del semidesierto mexicano, evidenciando la magnitud del desarrollo minero regional.",,Arquitectura industrial; Comarca Lagunera; Ingeniería hidráulica,"El Coyote, Matamoros, Coahuila, México",25.6886,-103.2671,,,,,,,,Image;StillImage,image/jpeg,es,,impresion_071.jpg,o9dx1h,image,/objects/impresion_071.jpg,/objects/small/impresion_071_sm.jpg,/objects/thumbs/impresion_071_th.jpg,,,Impresión plata gelatina de revelado,Película,Transmisión,Monocromático,Negativo,Negativo
impresion_072,Retrato vernáculo,1905,,Anónimo,,"Retrato de una pareja de adultos en actitud afectuosa, sentados frente a una pared de ladrillos. El hombre, con bigote y traje oscuro, sonríe a la cámara mientras toma la mano de la mujer. Ella viste un vestido claro de época con detalles en el talle y cabello recogido. La escena sugiere un ambiente doméstico o informal de principios del siglo XX.",,Retrato vernáculo; Vestimenta eduardiana; Fotografía sobre cartón,Estados Unidos (Región del Medio Oeste o Noreste),41.8781,-87.6298,,,,,,,,Image;StillImage,image/jpeg,es,,impresion_072.jpg,4kvfg,image,/objects/impresion_072.jpg,/objects/small/impresion_072_sm.jpg,/objects/thumbs/impresion_072_th.jpg,,,Impresión plata gelatina de revelado,Vidrio,Transmisión,Policromático,Impresión,Positivo
impresion_073,Retrato de identidad,1950,,Anónimo,,"Retrato de busto de un hombre adulto mayor, capturado de frente con una expresión neutra. El sujeto presenta rasgos de envejecimiento marcados y viste una camisa de tono claro. La imagen está recortada en forma circular y muestra daños por desprendimiento de emulsión y marcas de grapas o tachuelas en los extremos laterales.",,Retrato de identidad; Fotografía de gelatina de plata; Cultura administrativa,"Buenos Aires, Argentina",-34.6037,-58.3816,,,,,,,,Image;StillImage,image/jpeg,es,,impresion_073.jpg,2kv3,image,/objects/impresion_073.jpg,/objects/small/impresion_073_sm.jpg,/objects/thumbs/impresion_073_th.jpg,,,Impresión plata gelatina de revelado,Papel,Reflexión,Monocromático,Impresión,Positivo
impresion_074,Lázaro Cárdenas del Río,1965,,Anónimo,,"Retrato frontal de busto de un hombre de edad avanzada con escasez de cabello en la parte superior. El sujeto viste una camisa de cuello abierto, posiblemente una guayabera o camisa de algodon ligera. La imagen posee una iluminacion plana y frontal, comun en la fotografia de estudio para documentos de identidad o registros civiles en el Mexico de mediados del siglo XX.",,Lázaro Cárdenas del Río; Retrato histórico; México posrevolucionario,"Ciudad de México, México",19.4326,-99.1332,,,,,,,,Image;StillImage,image/jpeg,es,,impresion_074.jpg,n20tdc,image,/objects/impresion_074.jpg,/objects/small/impresion_074_sm.jpg,/objects/thumbs/impresion_074_th.jpg,,,Impresión plata gelatina de revelado,Película,Transmisión,Monocromático,Negativo,Negativo
impresion_075,Retrato de estudio,1900,,Anónimo (Estudio comercial de fotografía rápida),,"Serie de tres retratos de estudio individuales dispuestos verticalmente sobre una tira de cartulina gris. La imagen superior e inferior muestran a mujeres con blusas de cuello alto y encajes, mientras que la central presenta a un hombre con pajarita. Los tres sujetos miran hacia la cámara con expresiones formales típicas del retrato de estudio comercial de cambio de siglo.",,Retrato de estudio; Moda eduardiana; Fotografía de sello,Estados Unidos (probablemente un estudio fotográfico urbano),39.8283,-98.5795,,,,,,,,Image;StillImage,image/jpeg,es,,impresion_075.jpg,gjrv9,image,/objects/impresion_075.jpg,/objects/small/impresion_075_sm.jpg,/objects/thumbs/impresion_075_th.jpg,,,Impresión plata gelatina de revelado,Papel,Reflexión,Monocromático,Impresión,Positivo
impresion_076,Retrato victoriano,1870,,Anónimo,,"Retrato de estudio de un infante de corta edad, sentado sobre un sillón tapizado con flecos decorativos. El niño o niña viste una prenda a cuadros de gran formato con detalles de encaje o pasamanería en el cuello y las mangas. La pose es estática y formal, característica de la fotografía comercial del siglo XIX.",,Retrato victoriano; Carte de Visite; Indumentaria infantil del siglo XIX,Estados Unidos (probable estudio fotográfico en la Costa Este),40.7128,-74.006,,,,,,,,Image;StillImage,image/jpeg,es,,impresion_076.jpg,xuudli,image,/objects/impresion_076.jpg,/objects/small/impresion_076_sm.jpg,/objects/thumbs/impresion_076_th.jpg,,,Albúmina,Vidrio,Transmisión,Monocromático,Impresión,Positivo
impresion_077,Moda de los años 30,1935,,Anónimo,,"Retrato grupal al aire libre de tres adultos, un hombre y dos mujeres, posando frente a una casa de madera. Visten indumentaria formal: el hombre con traje de tres piezas y las mujeres con conjuntos de falda y chaquetas. El suelo presenta restos de nieve y la imagen conserva una cinta de luto pegada en la esquina superior.",,Moda de los años 30; Arquitectura residencial estadounidense; Retrato invernal,Noreste de Estados Unidos o Canadá (ej. Nueva Inglaterra),42.3601,-71.0589,,,,,,,,Image;StillImage,image/jpeg,es,,impresion_077.jpg,mfsca,image,/objects/impresion_077.jpg,/objects/small/impresion_077_sm.jpg,/objects/thumbs/impresion_077_th.jpg,,,Impresión plata gelatina de revelado,Película,Transmisión,Monocromático,Negativo,Negativo
impresion_078,Retrato de estudio,1905,,Samuel P. Gresham (Gresham Studio),,"Retrato de busto de un hombre joven, de tez clara y mirada serena hacia un costado. Viste una chaqueta de traje oscura, camisa blanca de cuello alto rígido y una corbata oscura de nudo sencillo. La imagen está capturada en un estudio fotográfico profesional, enmarcada en un óvalo con bordes ornamentales grabados en relieve sobre un soporte de cartón gris texturizado.",,Retrato de estudio; Moda masculina eduardiana; Fotografía de Iowa,"Bloomfield, Iowa, Estados Unidos",40.7514,-92.4144,,,,,,,,Image;StillImage,image/jpeg,es,,impresion_078.jpg,dgan8,image,/objects/impresion_078.jpg,/objects/small/impresion_078_sm.jpg,/objects/thumbs/impresion_078_th.jpg,,,Colodión húmedo,Papel,Reflexión,Monocromático,Impresión,Positivo
impresion_079,Retrato de estudio,1900,,Pierce Studio,,"Retrato de estudio de un hombre adulto capturado a principios del siglo XX. El sujeto luce un bigote tupido tipo manubrio, viste traje oscuro de solapa ancha, camisa blanca con cuello rígido y corbata con un alfiler ornamental. La composición es un busto frontal dentro de un marco ovalado sobre un soporte rígido.",,Retrato de estudio; Moda masculina eduardiana; Fotografía de Iowa,"Ottumwa, Iowa, Estados Unidos",41.02,-92.4113,,,,,,,,Image;StillImage,image/jpeg,es,,impresion_079.jpg,2xkktt,image,/objects/impresion_079.jpg,/objects/small/impresion_079_sm.jpg,/objects/thumbs/impresion_079_th.jpg,,,Impresión plata gelatina de revelado,Papel,Reflexión,Policromático,Impresión,Positivo
impresion_080,Retrato de estudio,1905,,C. L. Gresham,,Retrato de estudio en formato busto de una mujer joven. Viste una prenda de tonos oscuros con aplicaciones de encaje y una blusa de cuello alto blanco. Porta un pequeño dije o medalla en el pecho y su cabello está peinado hacia arriba siguiendo la moda de la época. La fotografía está contenida en un óvalo decorativo sobre un soporte rígido.,,Retrato de estudio; Moda eduardiana; Fotografía estadounidense,"Bloomfield, Iowa, Estados Unidos",40.7514,-92.4144,,,,,,,,Image;StillImage,image/jpeg,es,,impresion_080.jpg,xs1xla,image,/objects/impresion_080.jpg,/objects/small/impresion_080_sm.jpg,/objects/thumbs/impresion_080_th.jpg,,,Impresión plata gelatina de revelado,Vidrio,Transmisión,Monocromático,Negativo,Negativo
impresion_081,Retrato de estudio,1905,,Anónimo (Estudio fotográfico comercial),,"Retrato de estudio de una mujer joven captada en un plano medio corto. La figura presenta un peinado recogido y viste una prenda oscura de cuello alto con detalles de pliegues verticales en el pecho, estilo característico de la moda femenina de finales del Porfiriato. La imagen central está montada sobre un cartón decorado con motivos ornamentales.",,Retrato de estudio; Moda eduardiana; Gelatina de plata,"Madrid, España",40.416775,-3.70379,,,,,,,,Image;StillImage,image/jpeg,es,,impresion_081.jpg,gky20i,image,/objects/impresion_081.jpg,/objects/small/impresion_081_sm.jpg,/objects/thumbs/impresion_081_th.jpg,,,Impresión de gelatina de plata sobre papel,Vidrio,Transmisión,Monocromático,Negativo,Negativo
impresion_082,Retrato de estudio,1905,,James W. Gresham,,"Retrato de estudio de un hombre joven de cabello oscuro y rasgos marcados, capturado en una pose de tres cuartos. Viste un traje formal con una camisa de cuello rígido y una corbata de seda con intrincados motivos ornamentales. La fotografía está contenida en un óvalo impreso sobre una montura de cartón grisáceo decorada con filigranas en relieve, característica de los estudios fotográficos comerciales estadounidenses de la época.",,Retrato de estudio; Moda eduardiana; Bloomfield Iowa,"Bloomfield, Iowa, Estados Unidos",40.7514,-92.4152,,,,,,,,Image;StillImage,image/jpeg,es,,impresion_082.jpg,sb13m,image,/objects/impresion_082.jpg,/objects/small/impresion_082_sm.jpg,/objects/thumbs/impresion_082_th.jpg,,,Impresión plata gelatina de revelado,Vidrio,Transmisión,Policromático,Negativo,Negativo
impresion_083,Moda de los años 20,1924,,Anónimo (Fotografía amateur),,"Fotografía de principios del siglo XX que captura a dos mujeres posando frente a los restos de una edificación de piedra, probablemente una estructura colonial en ruinas. Ambas visten abrigos largos y sombreros típicos de la época posrevolucionaria. La escena muestra una composición estática donde destaca el contraste entre la vestimenta urbana y el entorno rústico de la construcción deteriorada.",,Moda de los años 20; Turismo arqueológico; Sombrero cloche,Reino Unido (posiblemente una abadía medieval en ruinas en Inglaterra o Escocia),51.146,-2.715,,,,,,,,Image;StillImage,image/jpeg,es,,impresion_083.jpg,mtuq87,image,/objects/impresion_083.jpg,/objects/small/impresion_083_sm.jpg,/objects/thumbs/impresion_083_th.jpg,,,Impresión plata gelatina de revelado,Película,Transmisión,Monocromático,Impresión,Positivo
impresion_084,Plaza de San Marcos,1885,,Carlo Naya (o Studio Naya),,"Captura urbana de finales del siglo XIX que muestra la Plaza de San Marcos en Venecia. Al fondo se aprecia la fachada de la Basílica y a la derecha el Campanile. La escena registra el tránsito de personas con vestimentas de época, resaltando una mujer en el centro con traje oscuro y sombrero.",,Plaza de San Marcos; Venecia; Arquitectura Neobizantina,"Venecia, Italia",45.4341,12.3385,,,,,,,,Image;StillImage,image/jpeg,es,,impresion_084.jpg,553brl,image,/objects/impresion_084.jpg,/objects/small/impresion_084_sm.jpg,/objects/thumbs/impresion_084_th.jpg,,,Albúmina,Vidrio,Transmisión,Monocromático,Negativo,Negativo
impresion_085,Retrato de estudio,1920,,Anónimo,,"Retrato de estudio de una mujer joven de mirada frontal y expresión serena, peinada con un estilo ondulado característico de las décadas de 1920 o 1930. Viste una prenda oscura de cuello amplio con detalles ornamentales de pequeños botones o apliques en el frente. La imagen está montada en una carpeta protectora de cartón oscuro.",,Retrato de estudio; Moda años 20; Carpeta de cartón,Estados Unidos (Probable origen en estudio comercial urbano),40.712776,-74.005974,,,,,,,,Image;StillImage,image/jpeg,es,,impresion_085.jpg,90wgts,image,/objects/impresion_085.jpg,/objects/small/impresion_085_sm.jpg,/objects/thumbs/impresion_085_th.jpg,,,Impresión de gelatina de plata sobre papel de fibra,Vidrio,Transmisión,Monocromático,Negativo,Negativo
