objectid,title,date,date-is-approximate?,creator,recipient,description,item_information,subject,location,latitude,longitude,related_publication,publisher-digital,source,findingaid,original-identifier,rights,rightsstatement,type,format,language,relation,filename,identifier,display_template,object_location,image_small,image_thumb,image_alt_text,object_transcript,proceso,soporte,iluminacion,tono,tipologia,polaridad
impresion_118,Soporte de cartón,1870,,Anónimo,,"Esta imagen documenta el reverso de un soporte fotográfico histórico, posiblemente una tarjeta de gabinete o postal antigua. No contiene información visual, manuscrita ni sellos de fotógrafo, mostrando únicamente el desgaste natural del papel, el cual presenta una pátina amarillenta y manchas de oxidación ácida (foxing) consistentes con materiales de finales del siglo XIX.",,Soporte de cartón; Foxing; Fotografía decimonónica,Desconocida (Origen industrial europeo o americano),0,0,,,,,,,,Image;StillImage,image/jpeg,es,,impresion_118.jpg,h9pgah,image,/objects/impresion_118.jpg,/objects/small/impresion_118_sm.jpg,/objects/thumbs/impresion_118_th.jpg,,,Albúmina,Papel,Reflexión,Monocromático,Impresión,Positivo
impresion_119,Retrato victoriano,1890,,Anónimo,,"Retrato de estudio de una mujer joven sentada en una mecedora de madera torneada. La sujeto viste un atuendo formal de finales del siglo XIX, compuesto por una falda larga y un saco entallado. La escena está dispuesta frente a un telón con motivos florales, sobre un tapete decorativo y un pequeño descansapiés.",,Retrato victoriano; Mecedora; Moda femenina siglo XIX,Estados Unidos (Probable región del Medio Oeste o Costa Este),39.8283,-98.5795,,,,,,,,Image;StillImage,image/jpeg,es,,impresion_119.jpg,bkxkx,image,/objects/impresion_119.jpg,/objects/small/impresion_119_sm.jpg,/objects/thumbs/impresion_119_th.jpg,,,Colodión húmedo,Papel,Reflexión,Sepia,Impresión,Positivo
impresion_120,Verso fotográfico,1890,,Anónimo (Anotación de archivero),,"Vista posterior de una fotografía histórica sobre soporte de papel. Presenta un tono amarillento debido a la oxidación de la celulosa y el paso del tiempo, con presencia de manchas de oxidación o humedad tipo foxing. Se observa una marca manuscrita a lápiz en el cuadrante superior derecho con la cifra '125', indicativa de una clasificación de inventario o control archivístico.",,Verso fotográfico; Soporte de cartón; Ficha de inventario,Indeterminada (Conservado en un archivo histórico),0,0,,,,,,,,Image;StillImage,image/jpeg,es,,impresion_120.jpg,qrcfbg,image,/objects/impresion_120.jpg,/objects/small/impresion_120_sm.jpg,/objects/thumbs/impresion_120_th.jpg,,,Albúmina,Papel,Reflexión,Sepia,Impresión,Positivo
impresion_121,Decoración,1970,,William Eggleston,,"Vista interior de un rincón doméstico protagonizado por una lámpara de pie con fuste profusamente tallado y base decorada. El espacio cuenta con cortinas largas de pliegues uniformes a la izquierda y una rejilla de ventilación en la pared lateral, reflejando el estilo de diseño de interiores de mediados del siglo XX en un entorno urbano.",,Decoración; Arquitectura vernácula; Iluminación,"Memphis, Tennessee",35.1495,-90.049,,,,,,,,Image;StillImage,image/jpeg,es,,impresion_121.jpg,9t0jvj,image,/objects/impresion_121.jpg,/objects/small/impresion_121_sm.jpg,/objects/thumbs/impresion_121_th.jpg,,,Impresión plata gelatina de revelado,Película,Transmisión,Monocromático,Negativo,Negativo
impresion_122,Polaroid,1960,,Anónimo,,"Reverso de una fotografía instantánea con una anotación manuscrita en tinta azul que reza 'floor lamp, Bob & Leda's'. El documento presenta el sello de fábrica 'POLAROID' y un código de producción 'J602E2A' en el borde inferior, además de pequeñas manchas de oxidación o residuos de adhesivo en el margen izquierdo.",,Polaroid; Fotografía doméstica; Siglo XX,Estados Unidos,37.0902,-95.7129,,,,,,,,Image;StillImage,image/jpeg,es,,impresion_122.jpg,bbv96i,image,/objects/impresion_122.jpg,/objects/small/impresion_122_sm.jpg,/objects/thumbs/impresion_122_th.jpg,,,Impresión plata gelatina de revelado,Película,Transmisión,Monocromático,Impresión,Positivo
impresion_123,Vida suburbana,1962,,Anónimo,,"Retrato grupal familiar capturado al aire libre frente a una residencia. Se observa a dos mujeres con vestidos de patrones geométricos y florales, un hombre con traje formal y corbata, y dos infantes (un niño y una niña) vestidos de gala. La escena se sitúa junto a una escalinata de ladrillo y una silla plegable de jardín, reflejando un ambiente doméstico de clase media.",,Vida suburbana; Moda años 60; Retrato familiar,Estados Unidos de América (región del Medio Oeste o Noreste),39.8283,-98.5795,,,,,,,,Image;StillImage,image/jpeg,es,,impresion_123.jpg,ccmyw,image,/objects/impresion_123.jpg,/objects/small/impresion_123_sm.jpg,/objects/thumbs/impresion_123_th.jpg,,,Impresión plata gelatina de revelado,Película,Transmisión,Monocromático,Impresión,Positivo
impresion_124,Reverso fotográfico,1950,,Anónimo (Laboratorio fotográfico comercial),,"Reverso de una impresión fotográfica de mediados del siglo XX que muestra un borde lateral con acabado festoneado y diversas marcas de catalogación de laboratorio. La pieza presenta una forma irregular y signos de deterioro natural como manchas de oxidación y amarillamiento del papel, conservando códigos numéricos impresos que servían para la identificación industrial de la copia.",,Reverso fotográfico; Borde festoneado; Marcas de laboratorio,Desconocida (Origen comercial global),0,0,,,,,,,,Image;StillImage,image/jpeg,es,,impresion_124.jpg,vis4ib,image,/objects/impresion_124.jpg,/objects/small/impresion_124_sm.jpg,/objects/thumbs/impresion_124_th.jpg,,,Papel fotográfico de base de fibra (FB),Papel,Reflexión,Monocromático,Impresión,Positivo
impresion_125,Elecciones federales México 1979,1979,,Anónimo,,"Una mujer adulta con anteojos y chaleco tejido habla por un telfono de mesa en un entorno de oficina. A su izquierda, un tablero de anuncios contiene mltiples carteles de propaganda poltica mexicana que invitan a votar el 1 de julio. A la derecha, se observa parcialmente a un hombre con camisa rosada.",,Elecciones federales México 1979; Telefonía analógica; Fotografía Polaroid,"Ciudad de México, México",19.4326,-99.1332,,,,,,,,Image;StillImage,image/jpeg,es,,impresion_125.jpg,o6vzu,image,/objects/impresion_125.jpg,/objects/small/impresion_125_sm.jpg,/objects/thumbs/impresion_125_th.jpg,,,Impresión plata gelatina de revelado,Película,Transmisión,Monocromático,Impresión,Positivo
impresion_126,Película Kodak,1960,,Anónimo,,"Esta imagen presenta una hoja de película fotográfica de gran formato fabricada por Kodak. Se observa una superficie densa y oscura, carente de detalles figurativos claros, con signos evidentes de deterioro físico como rayaduras y motas de polvo. El borde inferior muestra la marca del fabricante, característica del material fotosensible profesional utilizado en archivos históricos.",,Película Kodak; Material fotosensible; Arqueología industrial,"Rochester, Nueva York (Sede de Eastman Kodak)",43.161,-77.6109,,,,,,,,Image;StillImage,image/jpeg,es,,impresion_126.jpg,670i5w,image,/objects/impresion_126.jpg,/objects/small/impresion_126_sm.jpg,/objects/thumbs/impresion_126_th.jpg,,,Impresión plata gelatina de revelado,Película,Transmisión,Monocromático,Impresión,Positivo
impresion_127,Arquitectura neocolonial,1960,,Anónimo,,"Escena de recreación en una villa o resort con arquitectura de estilo neocolonial. Una pareja joven en trajes de baño se encuentra junto a una piscina de aguas cristalinas que refleja la construcción. El entorno está decorado con palmeras y una luminaria ornamental, evocando el estilo de vida vacacional de la clase media-alta en el México de los años setenta.",,Arquitectura neocolonial; Turismo de mediados de siglo; Ocio y recreación,"Cuernavaca, Morelos, México",18.9242,-99.2216,,,,,,,,Image;StillImage,image/jpeg,es,,impresion_127.jpg,3hiu7j,image,/objects/impresion_127.jpg,/objects/small/impresion_127_sm.jpg,/objects/thumbs/impresion_127_th.jpg,,,Impresión plata gelatina de revelado,Película,Transmisión,Policromático,Negativo,Negativo
impresion_128,Fujifilm FP-100C,1993,,Anónimo,,"Fragmento de una fotografía instantánea que muestra un grupo de personas en el borde inferior, aparentemente en una reunión o evento social al aire libre. La imagen está severamente degradada o corresponde al negativo descartado del proceso de transferencia, presentando una gran superficie deslavada y restos de químicos de revelado en el margen derecho.",,Fujifilm FP-100C; Fotografía instantánea; Deterioro químico,Desconocida (Material de origen global),0,0,,,,,,,,Image;StillImage,image/jpeg,es,,impresion_128.jpg,xdbzau,image,/objects/impresion_128.jpg,/objects/small/impresion_128_sm.jpg,/objects/thumbs/impresion_128_th.jpg,,,Impresión plata gelatina de revelado,Película,Transmisión,Monocromático,Impresión,Positivo
impresion_129,Retrato de estudio,1964,,Anónimo (Fotógrafo de estudio comercial),,"Retrato de estudio de una mujer joven, datado aproximadamente en la decada de 1960. La figura luce un peinado estilo 'flip' con puntas hacia afuera y volumen superior, caracteristico de la moda de mediados del siglo XX. Viste una blusa oscura de cuello redondo y un collar con dije alargado frente a un fondo neutro difuminado.",,Retrato de estudio; Peinado bouffant; Moda años 60,Norteamérica (probablemente Estados Unidos),39.8283,-98.5795,,,,,,,,Image;StillImage,image/jpeg,es,,impresion_129.jpg,krej9o,image,/objects/impresion_129.jpg,/objects/small/impresion_129_sm.jpg,/objects/thumbs/impresion_129_th.jpg,,,Impresión plata gelatina de revelado,Papel,Reflexión,Policromático,Impresión,Positivo
impresion_130,Correspondencia personal,1970,,Donna (Anónimo),,"Reverso de una fotografía con un mensaje manuscrito en inglés fechado en 1970. Donna le escribe a Monica, refiriéndose a ella como una 'sudamericana' y expresando deseos de que disfrute su estancia en 'los Estados' (EE. UU.). Menciona recuerdos compartidos en una institución denominada 'B.H.S.', probablemente una escuela secundaria, y termina con una nota afectuosa.",,Correspondencia personal; Intercambio estudiantil; Cultura juvenil de 1970,"Estados Unidos (Lugar exacto indeterminado, referenciado como 'the states')",39.8283,-98.5795,,,,,,,,Image;StillImage,image/jpeg,es,,impresion_130.jpg,4x4y6d,image,/objects/impresion_130.jpg,/objects/small/impresion_130_sm.jpg,/objects/thumbs/impresion_130_th.jpg,,,Impresión plata gelatina de revelado,Papel,Reflexión,Monocromático,Impresión,Positivo
impresion_131,Moda eduardiana,1900,,Anónimo,,"Retrato de estudio de una mujer joven en una toma de busto. La retratada viste una blusa o vestido oscuro de cuello alto y pechera con finos pliegues verticales, complementado con una cadena delgada. Su cabello está recogido de manera sobria. La imagen está montada sobre un cartón grisáceo de grandes dimensiones con un marco decorativo en relieve.",,Moda eduardiana; Retrato de estudio; Fotografía montada,Europa Occidental o América del Norte,48.8566,2.3522,,,,,,,,Image;StillImage,image/jpeg,es,,impresion_131.jpg,xat68l,image,/objects/impresion_131.jpg,/objects/small/impresion_131_sm.jpg,/objects/thumbs/impresion_131_th.jpg,,,Impresión de gelatina de plata con virado sepia sobre papel,Vidrio,Transmisión,Sepia,Negativo,Negativo
impresion_132,Manuscrito,1904,,Anónimo,,"Reverso de una fotografía histórica montada sobre cartón rígido. Presenta inscripciones manuscritas a lápiz que incluyen un nombre propio y la fecha 'June 1907'. El soporte muestra signos de envejecimiento natural, como amarillamiento por oxidación de la lignina y manchas de foxing, lo que constituye un registro de su procedencia y temporalidad.",,Manuscrito; 1904; Brownsville,"Brownsville, Texas, Estados Unidos",25.9017,-97.4975,,,,,,,,Image;StillImage,image/jpeg,es,,impresion_132.jpg,wryclk,image,/objects/impresion_132.jpg,/objects/small/impresion_132_sm.jpg,/objects/thumbs/impresion_132_th.jpg,,,Soporte de cartulina de alto gramaje,Papel,Reflexión,Sepia,Impresión,Positivo
negativo_001,Primera Comunión,1950,,Anónimo,,Retrato de estudio o exterior de dos niños de diferentes edades durante una ceremonia de Primera Comunión. Ambos visten trajes formales claros con brazaletes distintivos en el brazo derecho; sostienen rosarios y velas largas ceremoniales. La composición centrada y la vestimenta reflejan las prácticas sociales y religiosas católicas predominantes en el México de mediados del siglo XX.,,Primera Comunión; Retrato de estudio; Negativo fotográfico,"Ciudad de México, México",19.4326,-99.1332,,,,,,,,Image;StillImage,image/jpeg,es,,negativo_001.jpg,kscjb8,image,/objects/negativo_001.jpg,/objects/small/negativo_001_sm.jpg,/objects/thumbs/negativo_001_th.jpg,,,Negativo de hoja (sheet film) de formato 4x5 pulgadas,Película,Transmisión,Monocromático,Negativo,Negativo
negativo_002,Fotografía publicitaria,1945,,Agencia Casasola,,"Un infante con vestimenta clara y detalles de felpa posa sentado sobre un piso de diseño cuadriculado frente a un pastel decorado de tres niveles. Detrás del niño se observan grandes bloques de hielo translúcido, sugiriendo una escenografía de estudio preparada para una sesión comercial o temática capturada a mediados del siglo XX.",,Fotografía publicitaria; Refrigeración; Infancia,"Ciudad de México, México",19.432608,-99.133209,,,,,,,,Image;StillImage,image/jpeg,es,,negativo_002.jpg,2zgjat,image,/objects/negativo_002.jpg,/objects/small/negativo_002_sm.jpg,/objects/thumbs/negativo_002_th.jpg,,,Impresión plata gelatina de revelado,Película,Transmisión,Monocromático,Negativo,Negativo
negativo_003,Denali,1947,,Bradford Washburn,,"La imagen captura el detalle de una cumbre montañosa o volcánica nevada, característica del paisaje del Eje Neovolcánico mexicano. Se observa la textura rugosa de la nieve y el hielo sobre la formación geológica bajo una iluminación cenital. Este tipo de tomas eran frecuentes en las exploraciones geográficas y la fotografía de paisaje de mediados del siglo XX en México.",,Denali; Fotografía aérea; Bradford Washburn,"Denali National Park, Alaska",63.0692,-151.007,,,,,,,,Image;StillImage,image/jpeg,es,,negativo_003.jpg,mtv3x8,image,/objects/negativo_003.jpg,/objects/small/negativo_003_sm.jpg,/objects/thumbs/negativo_003_th.jpg,,,Negativo sobre soporte de acetato de celulosa (Safety Film),Película,Transmisión,Monocromático,Negativo,Negativo
negativo_004,Síndrome del vinagre,1940,,Anónimo (Atribuible a fotógrafos de la FSA o departamentos de obras públicas),,"Imagen histórica en estado avanzado de degradación física que muestra fragmentos de una escena documental del periodo revolucionario mexicano. La descomposición química del soporte ha fracturado la emulsión, creando un entramado de grietas y pliegues que oscurecen los detalles originales de la composición, dejando apenas visibles formas que sugieren estructuras arquitectónicas o figuras humanas en un entorno urbano.",,Síndrome del vinagre; Arqueología industrial; Preservación fílmica,"Nueva York, Estados Unidos (Zona industrial o puentes del East River)",40.7073,-73.9907,,,,,,,,Image;StillImage,image/jpeg,es,,negativo_004.jpg,5k1t2p,image,/objects/negativo_004.jpg,/objects/small/negativo_004_sm.jpg,/objects/thumbs/negativo_004_th.jpg,,,Impresión plata gelatina de revelado,Película,Transmisión,Monocromático,Negativo,Negativo
negativo_005,Tennessee Valley Authority,1934,,Lewis Wickes Hine,,"Vista interior de una instalación institucional, posiblemente una cocina industrial, laboratorio o farmacia de mediados del siglo XX. Se aprecia un mostrador con armarios de diseño geométrico, equipo de procesamiento con ducto de ventilación y una puerta que conduce a una habitación contigua con bancos y mesas de trabajo, todo en una composición deshabitada.",,Tennessee Valley Authority; Norris Tennessee; New Deal Architecture,"Norris, Tennessee, EE. UU.",36.1992,-84.0664,,,,,,,,Image;StillImage,image/jpeg,es,,negativo_005.jpg,e89yep,image,/objects/negativo_005.jpg,/objects/small/negativo_005_sm.jpg,/objects/thumbs/negativo_005_th.jpg,,,Negativo original en película de nitrato de celulosa,Película,Transmisión,Monocromático,Negativo,Negativo
negativo_006,Deterioro de nitrato,1940,,Hermanos Mayo (Agencia),,"La imagen presenta un negativo fotográfico en un estado crítico de deterioro físico y químico, lo que dificulta la identificación precisa del tema. Se alcanzan a percibir siluetas que sugieren un paisaje o una escena exterior con estructuras verticales, posiblemente árboles o arquitectura, veladas por una densa red de grietas y burbujas resultantes de la degradación del soporte material.",,Deterioro de nitrato; Hermanos Mayo; Conservación de archivos,"Archivo General de la Nación (Palacio de Lecumberri), Ciudad de México",19.4352,-99.1122,,,,,,,,Image;StillImage,image/jpeg,es,,negativo_006.jpg,tb0o4,image,/objects/negativo_006.jpg,/objects/small/negativo_006_sm.jpg,/objects/thumbs/negativo_006_th.jpg,,,Película de hoja (sheet film) de formato 4x5 pulgadas,Película,Transmisión,Monocromático,Impresión,Positivo
negativo_007,Farm Security Administration,1940,,Russell Lee,,"Vista interior de un espacio arquitectónico, posiblemente una cocina o taller de mediados del siglo XX. Se distingue un mostrador con armarios bajos y tuberías en la parte superior derecha. Un umbral a la izquierda revela una habitación contigua con sillas. La imagen está severamente distorsionada por la degradación química del soporte plástico.",,Farm Security Administration; Vida rural; Pie Town,"Pie Town, Condado de Catron, Nuevo México, Estados Unidos",34.2978,-108.1345,,,,,,,,Image;StillImage,image/jpeg,es,,negativo_007.jpg,jbd7t8,image,/objects/negativo_007.jpg,/objects/small/negativo_007_sm.jpg,/objects/thumbs/negativo_007_th.jpg,,,Impresión plata gelatina de revelado,Película,Transmisión,Monocromático,Negativo,Negativo
negativo_008,Northrop N-1M,1940,,"Fotógrafo corporativo de Northrop Aircraft, Inc.",,"Vista de un negativo fotográfico con severo deterioro químico y físico. Se distinguen formas geométricas y líneas diagonales que sugieren la estructura interna de un edificio o una composición arquitectónica modernista. El daño del soporte impide una identificación clara del sujeto, enfocando la atención en la materialidad del objeto archivístico.",,Northrop N-1M; Ala volante; Síndrome del vinagre,"Hawthorne, California, EE. UU.",33.9237,-118.3323,,,,,,,,Image;StillImage,image/jpeg,es,,negativo_008.jpg,upb18i,image,/objects/negativo_008.jpg,/objects/small/negativo_008_sm.jpg,/objects/thumbs/negativo_008_th.jpg,,,Impresión plata gelatina de revelado,Película,Transmisión,Monocromático,Negativo,Negativo
negativo_009,Primera Comunión,1940,,Agustín Víctor Casasola (Estudio),,"Retrato de dos jóvenes masculinos de pie en un exterior, vistiendo uniformes de gala claros que incluyen gorras, sacos de cuello cerrado y pantalones. Ambos sostienen en una mano un pequeño libro (posiblemente un misal) con un rosario colgando y en la otra un báculo o cirio largo. La imagen presenta una degradación física circular prominente que rodea a los sujetos, característica de daños por conservación en el soporte original.",,Primera Comunión; Estudio Casasola; Negativo de seguridad,"Ciudad de México, México",19.4326,-99.1332,,,,,,,,Image;StillImage,image/jpeg,es,,negativo_009.jpg,40k4in,image,/objects/negativo_009.jpg,/objects/small/negativo_009_sm.jpg,/objects/thumbs/negativo_009_th.jpg,,,Impresión plata gelatina de revelado,Película,Transmisión,Monocromático,Negativo,Negativo
negativo_010,Estudio Scurlock,1940,,Scurlock Studio (Addison N. Scurlock),,"Retrato de medio cuerpo de una persona, aparentemente una mujer de origen rural o indígena, que porta un rebozo o toca de color claro cubriendo su cabeza. La figura se encuentra en una pose frontal contra un fondo neutro. La imagen está severamente alterada por un fenómeno de degradación física que crea una textura de gotas o burbujas microscópicas que cubren gran parte de la composición central.",,Estudio Scurlock; Deterioro de emulsión; Afrodescendientes,"Washington, D.C., Estados Unidos",38.9149,-77.0305,,,,,,,,Image;StillImage,image/jpeg,es,,negativo_010.jpg,52edd,image,/objects/negativo_010.jpg,/objects/small/negativo_010_sm.jpg,/objects/thumbs/negativo_010_th.jpg,,,Impresión plata gelatina de revelado,Película,Transmisión,Monocromático,Negativo,Negativo
negativo_024,Retrato de estudio,1900,,Anónimo (Atribuido al estilo de los Estudios Casasola o similar),,Retrato de estudio de una mujer joven con vestimenta formal de finales del siglo XIX o inicios del XX. La figura porta una blusa de cuello alto decorada con encaje intrincado y joyería que incluye una cruz y un dije de medialuna. Su peinado recogido y el estilo de la prenda sugieren una pertenencia a la clase media o alta urbana de la época.,,Retrato de estudio; Placa de vidrio; Belle Époque,"Ciudad de México, México",19.4326,-99.1332,,,,,,,,Image;StillImage,image/jpeg,es,,negativo_024.jpg,7unx4l,image,/objects/negativo_024.jpg,/objects/small/negativo_024_sm.jpg,/objects/thumbs/negativo_024_th.jpg,,,Negativo de placa de vidrio al gelatino-bromuro (dry plate),Vidrio,Transmisión,Monocromático,Negativo,Negativo
negativo_025,Negativo de placa de vidrio,1915,,George Grantham Bain (Bain News Service),,"Retrato grupal masculino en un interior. Se observa a seis hombres: uno sentado en primer plano y cinco de pie rodeándolo. Visten indumentaria formal que incluye sacos oscuros y camisas de cuello rígido. El entorno sugiere una oficina o despacho de principios del siglo XX, con mobiliario de madera y una lámpara cenital visible al fondo.",,Negativo de placa de vidrio; Uniforme naval; Alistamiento militar,"Great Lakes Naval Training Station, Illinois, Estados Unidos",42.3045,-87.8427,,,,,,,,Image;StillImage,image/jpeg,es,,negativo_025.jpg,wpe3y8,image,/objects/negativo_025.jpg,/objects/small/negativo_025_sm.jpg,/objects/thumbs/negativo_025_th.jpg,,,Impresión plata gelatina de revelado,Vidrio,Transmisión,Monocromático,Impresión,Positivo
negativo_026,Jubilæumsstævne,1930,,Holger Damgaard o agencia Nordfoto,,"Imagen en negativo que captura a una multitud sentada en gradas durante una ceremonia oficial. Los asistentes, vestidos con ropa formal de gala, incluyen hombres de edad avanzada con trajes oscuros y mujeres con vestidos de media gala y sombreros. Un cartel informativo en una columna a la izquierda anuncia un evento conmemorativo relacionado con países escandinavos, sugiriendo una reunión diplomática o cultural internacional.",,Jubilæumsstævne; Copenhague; Realeza Danesa,"Copenhague, Dinamarca (posiblemente Københavns Rådhus o Idrætsparken)",55.6761,12.5683,,,,,,,,Image;StillImage,image/jpeg,es,,negativo_026.jpg,v5u7gi,image,/objects/negativo_026.jpg,/objects/small/negativo_026_sm.jpg,/objects/thumbs/negativo_026_th.jpg,,,Impresión plata gelatina de revelado,Película,Transmisión,Monocromático,Negativo,Negativo
negativo_027,Negativo de vidrio,1890,,Anónimo,,"Vista exterior de una residencia rural de madera con arquitectura de influencia anglosajona, caracterizada por techos inclinados y tres chimeneas prominentes. Dos árboles de gran tamaño, sin follaje, flanquean la estructura central. La escena, desprovista de figuras humanas, evoca un entorno doméstico en una estación invernal o de transición.",,Negativo de vidrio; Granja histórica; Nueva Inglaterra,"Nueva Inglaterra, Estados Unidos",43.1939,-71.5724,,,,,,,,Image;StillImage,image/jpeg,es,,negativo_027.jpg,sgo26o,image,/objects/negativo_027.jpg,/objects/small/negativo_027_sm.jpg,/objects/thumbs/negativo_027_th.jpg,,,Placa seca de gelatina sobre vidrio (Gelatin dry plate),Vidrio,Transmisión,Monocromático,Impresión,Positivo
negativo_028,Arquitectura vernacular,1890,,Anónimo,,"Vista de un conjunto rural compuesto por una casa de dos niveles y una estructura de madera que funciona como granero o bodega. La escena incluye árboles delgados sin follaje situados entre las edificaciones, sugiriendo una estación fría o un clima semiárido. El terreno es llano y despejado, característico de un asentamiento agrícola o ganadero en una zona de llanura, capturado en un plano general que muestra la disposición de las construcciones.",,Arquitectura vernacular; Negativo sobre vidrio; Vida rural,"Nueva Inglaterra, Estados Unidos",44,-72,,,,,,,,Image;StillImage,image/jpeg,es,,negativo_028.jpg,1unqo,image,/objects/negativo_028.jpg,/objects/small/negativo_028_sm.jpg,/objects/thumbs/negativo_028_th.jpg,,,Placa seca de gelatina sobre soporte de vidrio (Dry Plate),Vidrio,Transmisión,Monocromático,Impresión,Positivo
negativo_029,Fotoperiodismo,1940,,Weegee (Arthur Fellig),,"Una toma documental que registra los daños estructurales de un automovil sedan tras una colision frontal en un entorno nocturno. El vehiculo presenta el cofre y la parrilla colapsados, con un resorte de suspension y piezas del parachoques esparcidas en el asfalto. Un hombre de pie observa la escena, capturada con la cruda estetica del periodismo policial mexicano de mediados del siglo XX.",,Fotoperiodismo; Accidente de tráfico; Weegee,"Nueva York, Estados Unidos",40.712776,-74.005974,,,,,,,,Image;StillImage,image/jpeg,es,,negativo_029.jpg,89z66,image,/objects/negativo_029.jpg,/objects/small/negativo_029_sm.jpg,/objects/thumbs/negativo_029_th.jpg,,,Impresión plata gelatina de revelado,Película,Transmisión,Monocromático,Negativo,Negativo
