objectid,title,date,date-is-approximate?,creator,recipient,description,item_information,subject,location,latitude,longitude,related_publication,publisher-digital,source,findingaid,original-identifier,rights,rightsstatement,type,format,language,relation,filename,identifier,display_template,object_location,image_small,image_thumb,image_alt_text,object_transcript,proceso,soporte,iluminacion,tono,tipologia,polaridad
transparencia_004,Anatomía humana,1970,,Nush Process S.A. (Laboratorio); Ilustración de L. Testut / A. Latarjet,,"Ilustraci3n anat3mica detallada del hueso palatino derecho en sus aspectos medial y posterior. La imagen muestra diversas estructuras marcadas con terminolog3a cient3fica, como el proceso orbital y la l3mina horizontal. Este tipo de material serv3a como recurso did3ctico visual para la ense#anza de la osteolog3a en instituciones educativas de M3xico.",,Anatomía humana; Material didáctico; Músculos suboccipitales,"Barcelona, España",41.3951,2.1611,,,,,,,,Image;StillImage,image/jpeg,es,,transparencia_004.jpg,itut7,image,/objects/transparencia_004.jpg,/objects/small/transparencia_004_sm.jpg,/objects/thumbs/transparencia_004_th.jpg,,,Impresión plata gelatina de revelado,Película,Transmisión,Policromático,Diapositiva,Positivo
transparencia_005,Anatomía humana,1950,,Basado en ilustraciones de Johannes Sobotta; autor de la diapositiva anónimo,,"Diagrama anatómico científico que ilustra la sexta vértebra cervical (C6) desde una perspectiva superior. La imagen detalla las partes constitutivas del hueso, como el cuerpo vertebral, el proceso espinoso y los forámenes, utilizando terminología técnica en español y latín. Es un recurso gráfico destinado al estudio académico de la osteología humana.",,Anatomía humana; Material pedagógico; Osteología,"Madrid, España",40.4439,-3.7258,,,,,,,,Image;StillImage,image/jpeg,es,,transparencia_005.jpg,bbs4qa,image,/objects/transparencia_005.jpg,/objects/small/transparencia_005_sm.jpg,/objects/thumbs/transparencia_005_th.jpg,,,Impresión plata gelatina de revelado,Película,Transmisión,Monocromático,Diapositiva,Positivo
transparencia_006,Anatomía Humana,1930,,Johannes Sobotta (Ilustrador original) / Editorial Labor,,"Imagen educativa que retrata una vivienda de madera con techo de dos aguas y una escalera exterior, protegida por una cerca de estacas verticales. La escena, situada en un entorno de tundra, representa una casa de pobladores árticos (referidos históricamente como esquimales) y fue utilizada como material didáctico geográfico a principios del siglo XX.",,Anatomía Humana; Osteología; Ilustración Médica,"Barcelona, España",41.3851,2.1734,,,,,,,,Image;StillImage,image/jpeg,es,,transparencia_006.jpg,ls1g3p,image,/objects/transparencia_006.jpg,/objects/small/transparencia_006_sm.jpg,/objects/thumbs/transparencia_006_th.jpg,,,Impresión plata gelatina de revelado,Papel,Reflexión,Monocromático,Diapositiva,Positivo
transparencia_007,Keystone View Company,1910,,"Keystone View Company (Estudios Meadville, PA)",,"Escena rural de principios del siglo XX que muestra a una mujer con un vestido blanco de época, falda larga y cinturón oscuro, posando en un campo. A su lado se observa un gran pajar o almiar de forma cónica sostenido por postes de madera, junto a un muro de piedra seca y vegetación baja.",,Keystone View Company; Arquitectura Ártica; Diapositiva de linterna,"Alaska, Estados Unidos (Probablemente región de Nome o Point Barrow)",64.5011,-165.4064,,,,,,,,Image;StillImage,image/jpeg,es,,transparencia_007.jpg,5apxcl,image,/objects/transparencia_007.jpg,/objects/small/transparencia_007_sm.jpg,/objects/thumbs/transparencia_007_th.jpg,,,Placa de vidrio para linterna mágica (3,Vidrio,Transmisión,Policromático,Impresión,Positivo
transparencia_008,Pajar,1890,,Anónimo (Colección del Brooklyn Museum),,"Vista panorámica de la erupción de un géiser en un entorno natural rodeado de densos bosques de coníferas. La columna de vapor y agua emerge con fuerza desde una base de formaciones minerales, mientras que en primer plano se observa el flujo de agua caliente sobre el terreno.",,Pajar; Vida rural; Linterna mágica,"Estado de Nueva York (posiblemente Long Island o el Valle del Hudson), EE. UU.",41.5236,-74.0215,,,,,,,,Image;StillImage,image/jpeg,es,,transparencia_008.jpg,2un3do,image,/objects/transparencia_008.jpg,/objects/small/transparencia_008_sm.jpg,/objects/thumbs/transparencia_008_th.jpg,,,Placa de vidrio para linterna mágica de 3,Vidrio,Transmisión,Monocromático,Impresión,Positivo
transparencia_009,Parque Nacional Yellowstone,1890,,F. Jay Haynes (Haynes Studios),,"Vista de un camino rural flanqueado por densa vegetaci n tropical, donde destacan palmeras de gran altura a la derecha. En el primer plano a la izquierda, se distinguen dos figuras masculinas de pie, posiblemente exploradores o residentes, portando indumentaria clara. La escena captura la atm 3sfera de una regi n costera o tropical mexicana a principios del siglo XX.",,Parque Nacional Yellowstone; Géiser; Linterna Mágica,"Upper Geyser Basin, Parque Nacional Yellowstone, Wyoming, Estados Unidos.",44.4758,-110.835,,,,,,,,Image;StillImage,image/jpeg,es,,transparencia_009.jpg,a4br3q,image,/objects/transparencia_009.jpg,/objects/small/transparencia_009_sm.jpg,/objects/thumbs/transparencia_009_th.jpg,,,Impresión plata gelatina de revelado,Vidrio,Transmisión,Monocromático,Impresión,Positivo
transparencia_010,Placa de vidrio,1900,,Anónimo (Atribuido a la colección del Rijksmuseum),,"Vista de un camino rural rodeado de vegetacion tropical y palmeras. En el margen izquierdo se observan dos figuras masculinas de pie, vistiendo trajes formales oscuros y sombreros. Hacia la derecha, un animal cuadrupedo de pelaje blanco aparece desenfocado en el pastizal. La imagen captura la transicion hacia la fotografia en color a principios del siglo XX.",,Placa de vidrio; Paisaje tropical; Fotografía colonial,"Paramaribo, Surinam",5.8666,-55.1666,,,,,,,,Image;StillImage,image/jpeg,es,,transparencia_010.jpg,mc0csn,image,/objects/transparencia_010.jpg,/objects/small/transparencia_010_sm.jpg,/objects/thumbs/transparencia_010_th.jpg,,,Soporte de vidrio (placa seca),Vidrio,Transmisión,Monocromático,Impresión,Positivo
transparencia_011,Autocromo,1913,,Auguste Léon,,"Paisaje rural que muestra un conjunto de palmeras en una zona tropical, probablemente en las regiones costeras de México. Las siluetas de las frondas destacan contra el fondo, capturando la densidad de la vegetación local. La composición sugiere un registro documental de la flora en un entorno natural sin presencia humana visible.",,Autocromo; Cuba colonial; Paisaje tropical,"Matanzas, Cuba",23.0411,-81.5775,,,,,,,,Image;StillImage,image/jpeg,es,,transparencia_011.jpg,gezrwl,image,/objects/transparencia_011.jpg,/objects/small/transparencia_011_sm.jpg,/objects/thumbs/transparencia_011_th.jpg,,,Placa de vidrio de autocromo (Lumière Autochrome),Vidrio,Transmisión,Policromático,Impresión,Positivo
transparencia_012,Paisaje tropical,1890,,Anónimo (Círculo de fotógrafos del Tropenmuseum),,"Paisaje tropical que muestra un conjunto de palmeras de coco contra un cielo brumoso o nublado. En la parte inferior se observa vegetación densa y lo que parece ser el perfil de una construcción vernácula. La toma destaca por su valor documental sobre la flora costera, a pesar de la pérdida significativa de imagen en los márgenes.",,Paisaje tropical; Placa de vidrio; Indias Orientales Neerlandesas,"Isla de Java, Indonesia",-7.2575,112.7521,,,,,,,,Image;StillImage,image/jpeg,es,,transparencia_012.jpg,xo4kk,image,/objects/transparencia_012.jpg,/objects/small/transparencia_012_sm.jpg,/objects/thumbs/transparencia_012_th.jpg,,,Impresión plata gelatina de revelado,Vidrio,Transmisión,Monocromático,Impresión,Positivo
transparencia_013,Palmeras,1940,,Anónimo,,"Retrato de un hombre maduro con calvicie frontal y bigote, capturado en un momento de lectura. El sujeto está sentado en un sillón con reposabrazos curvos, vistiendo un traje formal de tres piezas con saco, chaleco y corbata. La iluminación es lateral y dramática, resaltando su perfil mientras sostiene un libro abierto, lo que sugiere un entorno intelectual o doméstico privado de mediados del siglo XX.",,Palmeras; Paisaje tropical; Deterioro fotográfico,Región del Caribe o Sureste Mexicano (Yucatán),20.9673,-89.5925,,,,,,,,Image;StillImage,image/jpeg,es,,transparencia_013.jpg,w5tiox,image,/objects/transparencia_013.jpg,/objects/small/transparencia_013_sm.jpg,/objects/thumbs/transparencia_013_th.jpg,,,Negativo o impresión sobre soporte flexible,Película,Transmisión,Monocromático,Negativo,Negativo
transparencia_014,Retrato histórico,1955,,Anónimo,,"Vista interior de una sala que muestra un conjunto de mobiliario de mediados del siglo XX. Destaca un sofá de tres plazas y un sillón individual tapizados en piel o vinil de color rojo brillante, acompañados por una mesa lateral de madera con una lámpara clásica. En la pared blanca cuelgan dos grabados antiguos enmarcados que representan escenas urbanas históricas.",,Retrato histórico; Cultura del siglo XX; Proceso Ektachrome,"Madrid, España",40.4167,-3.7033,,,,,,,,Image;StillImage,image/jpeg,es,,transparencia_014.jpg,xp208l,image,/objects/transparencia_014.jpg,/objects/small/transparencia_014_sm.jpg,/objects/thumbs/transparencia_014_th.jpg,,,Impresión plata gelatina de revelado,Película,Transmisión,Policromático,Diapositiva,Positivo
transparencia_015,Mid-century modern,1960,,Anónimo (Fotógrafo comercial de Eastman Kodak),,"Un hombre mayor se encuentra sentado en un sillón de madera, inclinado hacia adelante mientras lee atentamente un libro. Viste de manera formal con un saco oscuro y corbata. La imagen, capturada en un espacio interior sobrio, muestra una iluminación dirigida que destaca el rostro del sujeto y las páginas del volumen.",,Mid-century modern; Fotografía publicitaria; Diseño de interiores,"Rochester, Nueva York, Estados Unidos",43.1566,-77.6088,,,,,,,,Image;StillImage,image/jpeg,es,,transparencia_015.jpg,fqmmb,image,/objects/transparencia_015.jpg,/objects/small/transparencia_015_sm.jpg,/objects/thumbs/transparencia_015_th.jpg,,,Impresión plata gelatina de revelado,Película,Transmisión,Policromático,Impresión,Positivo
transparencia_016,Chaim Weizmann,1948,,G. Eric and Edith Matson (Matson Photograph Service),,"Fotografía de estudio que presenta un archivador de madera de tres niveles con acabados clásicos y herrajes metálicos dorados. Sobre el mueble, en una pared lisa, cuelga un cuadro enmarcado que representa una escena cinegética con perros de caza. La composición y la iluminación sugieren una toma para catálogo comercial o registro de diseño de interiores.",,Chaim Weizmann; Estado de Israel; Transparencia de color,"Casa Weizmann, Rehovot, Israel",31.9125,34.8058,,,,,,,,Image;StillImage,image/jpeg,es,,transparencia_016.jpg,tpy8r8,image,/objects/transparencia_016.jpg,/objects/small/transparencia_016_sm.jpg,/objects/thumbs/transparencia_016_th.jpg,,,Impresión plata gelatina de revelado,Película,Transmisión,Policromático,Diapositiva,Positivo
transparencia_017,Mobiliario de oficina,1945,,Theodore Horydczak,,"Fotografía a color de una silla de oficina de estilo clásico, tapizada en cuero oscuro con botones de capitoné y tachuelas de latón. El mueble posee descansabrazos y una base de madera de cinco radios con rueditas. Se encuentra situada sobre el césped de un jardín exterior con vegetación densa al fondo, probablemente capturada para fines de inventario institucional.",,Mobiliario de oficina; Ebanistería clásica; Fotografía comercial,"Washington D.C., Estados Unidos",38.8899,-77.0091,,,,,,,,Image;StillImage,image/jpeg,es,,transparencia_017.jpg,kiwx3g,image,/objects/transparencia_017.jpg,/objects/small/transparencia_017_sm.jpg,/objects/thumbs/transparencia_017_th.jpg,,,Placa de película de seguridad (Safety Film) de color,Película,Transmisión,Policromático,Impresión,Positivo
transparencia_018,Mobiliario de oficina,1960,,Charles y Ray Eames (Eames Office),,"Retrato de perfil de una joven sentada en un espacio interior austero. La mujer viste un vestido claro con estampados sutiles y mangas cortas abullonadas, y lleva el cabello peinado con una trenza larga. Una luz lateral intensa desde una ventana invisible genera un fuerte contraste, resaltando su expresión pensativa mientras mira hacia un costado en un ambiente de calma.",,Mobiliario de oficina; Ektachrome; Diseño industrial,"Eames House, Pacific Palisades, California, Estados Unidos.",34.0298,-118.5196,,,,,,,,Image;StillImage,image/jpeg,es,,transparencia_018.jpg,aqtka,image,/objects/transparencia_018.jpg,/objects/small/transparencia_018_sm.jpg,/objects/thumbs/transparencia_018_th.jpg,,,Impresión plata gelatina de revelado,Película,Transmisión,Policromático,Impresión,Positivo
transparencia_019,Retrato,1950,,Nacho López,,"Retrato de estudio de una mujer de mediana edad en un interior. Viste un vestido oscuro de media manga con un detalle claro en el escote, posiblemente un collar o aplique, y sostiene un abanico cerrado en su mano derecha. La postura es formal y la ambientación muestra elementos domésticos sencillos como cortinas al fondo, típicos de la retratística de mediados del siglo XX.",,Retrato; México; Años 1950,"Ciudad de México, México",19.4326,-99.1332,,,,,,,,Image;StillImage,image/jpeg,es,,transparencia_019.JPG,evm0k,image,/objects/transparencia_019.JPG,/objects/small/transparencia_019_sm.jpg,/objects/thumbs/transparencia_019_th.jpg,,,Impresión plata gelatina de revelado,Película,Transmisión,Policromático,Negativo,Negativo
transparencia_020,Retrato femenino,1955,,Anónimo,,"Una fotograf&iacute;a de estudio que muestra una silla de dise&ntilde;o moderno, tapizada en un intenso color rojo con detalles de tachuelas doradas en el contorno del respaldo y el asiento. La pieza cuenta con patas de madera que terminan en regatones met&aacute;licos, dispuesta sobre un fondo de estudio con un patr&oacute;n de l&iacute;neas horizontales suaves.",,Retrato femenino; Moda años 50; Degradación cromática,"Ciudad de México, México",19.4326,-99.1332,,,,,,,,Image;StillImage,image/jpeg,es,,transparencia_020.JPG,6l41zl,image,/objects/transparencia_020.JPG,/objects/small/transparencia_020_sm.jpg,/objects/thumbs/transparencia_020_th.jpg,,,Impresión plata gelatina de revelado,Película,Transmisión,Policromático,Impresión,Positivo
transparencia_021,Mobiliario de lujo,1946,,Gottscho-Schleisner,,"Retrato de estudio de una persona joven de cabello corto y ondulado, capturada en plano medio. Viste un suéter de punto en color magenta con un diseño de cuello cruzado y mangas cortas. La iluminación es suave y frontal, destacando una expresión neutra sobre un fondo interior minimalista y desenfocado que sugiere un entorno doméstico o de estudio profesional.",,Mobiliario de lujo; Estilo Klismos; Diseño de Interiores,"Nueva York, Estados Unidos",40.7484,-73.9857,,,,,,,,Image;StillImage,image/jpeg,es,,transparencia_021.jpg,1r6w2t,image,/objects/transparencia_021.jpg,/objects/small/transparencia_021_sm.jpg,/objects/thumbs/transparencia_021_th.jpg,,,Impresión plata gelatina de revelado,Película,Transmisión,Policromático,Impresión,Positivo
transparencia_022,Retrato,1955,,Charles 'Teenie' Harris,,"Una familia de cuatro personas posa en lo que parece ser un malecón costero en México a finales de los años 50. El grupo, vestido con bañadores y sombreros de la época, está flanqueado por un automóvil clásico y un paisaje de montañas frente al mar, típico de destinos como Acapulco.",,Retrato; Hill District; Comunidad Afroamericana,"Pittsburgh, Pennsylvania, Estados Unidos",40.4406,-79.9959,,,,,,,,Image;StillImage,image/jpeg,es,,transparencia_022.jpg,6rk5sc,image,/objects/transparencia_022.jpg,/objects/small/transparencia_022_sm.jpg,/objects/thumbs/transparencia_022_th.jpg,,,Impresión plata gelatina de revelado,Película,Transmisión,Policromático,Diapositiva,Positivo
transparencia_023,Turismo costero,1958,,Anónimo,,"Escena costera en Westerland, isla de Sylt, Alemania, capturada hacia 1970. En la imagen se observa a diversos veraneantes descansando en la arena y haciendo uso de las tradicionales sillas de playa alemanas (Strandkörbe). Al fondo destaca el edificio 'Haus am Meer', un exponente de la arquitectura moderna de ocio de la posguerra.",,Turismo costero; Venezuela años 50; Moda de baño retro,"Macuto, Estado La Guaira, Venezuela",10.6136,-66.8856,,,,,,,,Image;StillImage,image/jpeg,es,,transparencia_023.jpg,4mlqll,image,/objects/transparencia_023.jpg,/objects/small/transparencia_023_sm.jpg,/objects/thumbs/transparencia_023_th.jpg,,,Impresión plata gelatina de revelado,Película,Transmisión,Policromático,Impresión,Positivo
transparencia_024,Turismo de masas,1970,,Anónimo,,"Una escena de mercado tradicional o tianguis en el atrio de una iglesia colonial. Un grupo numeroso de hombres y mujeres, vestidos con ropas de manta clara y sombreros de ala ancha, se congregan entre puestos protegidos por toldos de tela blanca. Al fondo destaca la arquitectura de un templo con cúpula y una torre campanario de dos cuerpos bajo un cielo despejado.",,Turismo de masas; Arquitectura modernista; Strandkorb,"Playa de Westerland (Brandenburger Strand), Isla de Sylt, Alemania",54.9083,8.2986,,,,,,,,Image;StillImage,image/jpeg,es,,transparencia_024.jpg,9jj4nt,image,/objects/transparencia_024.jpg,/objects/small/transparencia_024_sm.jpg,/objects/thumbs/transparencia_024_th.jpg,,,Fotografía en color de formato medio (6x6 cm),Película,Transmisión,Policromático,Diapositiva,Positivo
transparencia_025,Tianguis,1910,,Gabriel Garduño,,Representación pictográfica colonial del siglo XVI dividida en cuatro cuadrantes que muestran escenas bélicas. Se aprecian combatientes indígenas con escudos redondos y macuahuitl enfrentando a jinetes europeos armados con lanzas. Cada panel contiene glosas en caracteres latinos que identifican poblaciones conquistadas durante las expediciones hacia el sur de Mesoamérica.,,Tianguis; Porfiriato; Arquitectura Colonial,"Amecameca de Juárez, Estado de México",19.1212,-98.7618,,,,,,,,Image;StillImage,image/jpeg,es,,transparencia_025.jpg,mh7j5r,image,/objects/transparencia_025.jpg,/objects/small/transparencia_025_sm.jpg,/objects/thumbs/transparencia_025_th.jpg,,,Impresión plata gelatina de revelado,Película,Transmisión,Policromático,Diapositiva,Negativo
transparencia_026,Lienzo de Tlaxcala,1550,,Fotógrafo del Archivo de la Biblioteca Nacional de Antropología e Historia (BNAH),,"Fotografía de estudio de mediados del siglo XX que presenta un conjunto de mobiliario de sala. Destacan un sofá de tres plazas y un sillón individual tapizados en piel roja, dispuestos sobre una alfombra de motivos orientales. La composición se complementa con una mesa lateral, una lámpara de mesa y dos grabados de barcos de vapor en la pared.",,Lienzo de Tlaxcala; Conquista de México; Códice colonial,"Tlaxcala, México",19.313333,-98.24,,,,,,,,Image;StillImage,image/jpeg,es,,transparencia_026.jpg,hhvxog,image,/objects/transparencia_026.jpg,/objects/small/transparencia_026_sm.jpg,/objects/thumbs/transparencia_026_th.jpg,,,Impresión plata gelatina de revelado,Película,Transmisión,Policromático,Impresión,Positivo
transparencia_027,Mobiliario Mid-Century Modern,1955,,Anónimo / Estudio de fotografía comercial (posiblemente Gottscho-Schleisner),,"Retrato de estudio de una mujer joven en una pose de estilo pin-up o glamour. La modelo aparece de medio cuerpo, de espaldas al espectador con el rostro vuelto hacia la cámara, luciendo una cabellera larga y oscura. La composición destaca por un fondo amarillo vibrante, el uso de una prenda inferior negra y un lienzo rojo sostenido frontalmente como elemento de contraste cromático.",,Mobiliario Mid-Century Modern; Fotografía comercial de catálogo; Diseño de interiores estadounidense,"Estados Unidos, probablemente High Point, Carolina del Norte",35.9556,-80.0053,,,,,,,,Image;StillImage,image/jpeg,es,,transparencia_027.jpg,9i21x1,image,/objects/transparencia_027.jpg,/objects/small/transparencia_027_sm.jpg,/objects/thumbs/transparencia_027_th.jpg,,,Impresión plata gelatina de revelado,Película,Transmisión,Policromático,Impresión,Positivo
transparencia_028,Glamour,1975,,Anónimo,,"Retrato doble de dos infantes en un entorno doméstico, capturado para visualización tridimensional. Los niños visten ropones blancos y aparecen sentados sobre un cojín claro, interactuando con un pequeño bloque de juguete. La toma es un ejemplo clásico de fotografía familiar de mediados del siglo XX, utilizando película de diapositiva a color para preservar momentos cotidianos con alta fidelidad cromática.",,Glamour; Transparencia; Erotismo,"Ciudad de México, México",19.4326,-99.1332,,,,,,,,Image;StillImage,image/jpeg,es,,transparencia_028.jpg,r92j1h,image,/objects/transparencia_028.jpg,/objects/small/transparencia_028_sm.jpg,/objects/thumbs/transparencia_028_th.jpg,,,Se trata de una transparencia a color (diapositiva) montada,Papel,Reflexión,Policromático,Diapositiva,Positivo
transparencia_029,Estereoscopía,1950,,Anónimo (Fotógrafo aficionado),,"Retrato de tres niñas en una celebración familiar en México, posiblemente un cumpleaños o festividad religiosa, agrupadas frente a un elaborado pastel blanco de varios niveles decorado con columnas. Las niñas visten atuendos festivos de colores claros y peinados típicos de la clase media urbana de las décadas de 1960 o 1970, reflejando un momento de la vida cotidiana privada.",,Estereoscopía; Vida cotidiana; Kodachrome,Estados Unidos (Probablemente entorno doméstico suburbano),37.0902,-95.7129,,,,,,,,Image;StillImage,image/jpeg,es,,transparencia_029.jpg,nii15w,image,/objects/transparencia_029.jpg,/objects/small/transparencia_029_sm.jpg,/objects/thumbs/transparencia_029_th.jpg,,,Impresión plata gelatina de revelado,Vidrio,Transmisión,Policromático,Diapositiva,Positivo
transparencia_030,Celebración familiar,1964,,Anónimo,,"Escena doméstica capturada en una diapositiva a color que muestra a una mujer joven sentada en el jardín de una residencia, acompañada por dos infantes de corta edad. La composición, de carácter familiar y privado, documenta la vida cotidiana y la arquitectura residencial de mediados del siglo XX, destacando la vegetación ornamental y el mobiliario exterior.",,Celebración familiar; Moda infantil años 60; Diapositiva de color,"Ciudad de México, México",19.4326,-99.1332,,,,,,,,Image;StillImage,image/jpeg,es,,transparencia_030.jpg,h0fex,image,/objects/transparencia_030.jpg,/objects/small/transparencia_030_sm.jpg,/objects/thumbs/transparencia_030_th.jpg,,,Impresión plata gelatina de revelado,Película,Transmisión,Policromático,Diapositiva,Positivo
transparencia_031,Vida familiar,1962,,Anónimo,,"Fotografía estereoscópica que captura un evento social religioso en México, posiblemente una celebración de quince años o una boda. En la escena, una joven vestida con un traje blanco de falda de tul camina por el pasillo central de una iglesia, del brazo de un hombre en traje formal oscuro. El entorno está decorado con grandes arreglos de flores blancas a los costados.",,Vida familiar; Agfacolor; Retrato de posguerra,Alemania Occidental (posiblemente Leverkusen o región del Rin),51.0303,7.0041,,,,,,,,Image;StillImage,image/jpeg,es,,transparencia_031.jpg,66l26e,image,/objects/transparencia_031.jpg,/objects/small/transparencia_031_sm.jpg,/objects/thumbs/transparencia_031_th.jpg,,,Impresión plata gelatina de revelado,Película,Transmisión,Policromático,Diapositiva,Positivo
transparencia_032,Quinceañera,1955,,Estudio Fotos Sociales,,"Una escena doméstica captura una celebración infantil, posiblemente un cumpleaños, en el México de mediados del siglo XX. Un grupo de niños y jóvenes rodea una mesa dispuesta con un gran pastel de varios niveles y vasos con bebidas. La vestimenta, que incluye camisas abotonadas y diademas, refleja las convenciones sociales y la moda de la clase media urbana de la época.",,Quinceañera; Estereoscopía; México Moderno,"Luis Moya 112, Colonia Centro, Ciudad de México",19.4316,-99.1436,,,,,,,,Image;StillImage,image/jpeg,es,,transparencia_032.jpg,nu25h,image,/objects/transparencia_032.jpg,/objects/small/transparencia_032_sm.jpg,/objects/thumbs/transparencia_032_th.jpg,,,Impresión plata gelatina de revelado,Película,Transmisión,Policromático,Diapositiva,Positivo
transparencia_033,Celebración infantil,1960,,Anónimo,,"Vista estereoscópica de una orquesta mexicana en una presentación al aire libre. En el primer plano, un director de espaldas con traje formal oscuro gesticula hacia los músicos, quienes tocan instrumentos de viento madera. El conjunto integra elementos tradicionales, evidenciados por sombreros de charro colocados en las sillas, en lo que parece ser un concierto oficial o festividad cívica.",,Celebración infantil; Fotografía vernácula; México años 60,"Ciudad de México, México",19.4326,-99.1332,,,,,,,,Image;StillImage,image/jpeg,es,,transparencia_033.jpg,gha874,image,/objects/transparencia_033.jpg,/objects/small/transparencia_033_sm.jpg,/objects/thumbs/transparencia_033_th.jpg,,,Impresión plata gelatina de revelado,Película,Transmisión,Policromático,Diapositiva,Positivo
